{
 "add_total_row": 0,
 "columns": [
  {
   "fieldname": "posting_date",
   "fieldtype": "Date",
   "label": "Posting Date",
   "width": 150
  },
  {
   "fieldname": "name",
   "fieldtype": "Link",
   "label": "Name",
   "options": "Equipment",
   "width": 150
  },
  {
   "fieldname": "eq_status",
   "fieldtype": "Data",
   "label": "Equipment Status",
   "width": 150
  },
  {
   "fieldname": "item_code",
   "fieldtype": "Data",
   "label": "Item Code",
   "width": 150
  },
  {
   "fieldname": "location",
   "fieldtype": "Data",
   "label": "Location",
   "width": 150
  },
  {
   "fieldname": "reference_type",
   "fieldtype": "Data",
   "label": "DocType",
   "width": 150
  },
  {
   "fieldname": "status",
   "fieldtype": "Data",
   "label": "Status",
   "width": 150
  },
  {
   "fieldname": "reference",
   "fieldtype": "Data",
   "label": "Reference",
   "width": 150
  }
 ],
 "creation": "2022-07-14 08:35:59.264135",
 "disable_prepared_report": 0,
 "disabled": 0,
 "docstatus": 0,
 "doctype": "Report",
 "filters": [
  {
   "fieldname": "equipment",
   "fieldtype": "Link",
   "label": "Equipment",
   "mandatory": 1,
   "options": "Equipment",
   "wildcard_filter": 0
  }
 ],
 "idx": 0,
 "is_standard": "Yes",
 "modified": "2022-07-19 17:28:52.861795",
 "modified_by": "Administrator",
 "module": "Equipment Management",
 "name": "Equipment Ledger",
 "owner": "Administrator",
 "prepared_report": 0,
 "query": "select\n    IFNULL(eqprob.posting_date, eqprob.modified) as posting_date,\n    eq.name as name,\n    eq.status as eq_status,\n    eq.item_code as \"Item Code:Data/Item:150\",\n    eq.location as \"Location:Data/Location:150\",\n    doctype.name as \"DocType:Data/DocType:150\",\n    eqprob.status as \"Status:Select:150\",\n    eqprob.name as \"Reference:Dynamic Link/doc_type:150\"\n\nfrom\n    `tabEquipment` eq,`tabProblem Report` eqprob,`tabDocType` doctype,`tabRFID Trace` rf\nwhere\n    eq.name = eqprob.equipment and\n    eq.name = %(equipment)s and\n    doctype.name = 'Problem Report'\n\nunion\nselect\n    IFNULL(eqmaint.posting_date, eqmaint.modified) as posting_date,\n    eq.name as name,\n    eq.status as eq_status,\n    eq.item_code as item_code,\n    eq.location as location,\n    'Equipment Maintenance' as reference_type,\n    eqmaint.status as status,\n    eqmaint.name as reference\n\nfrom \n    `tabEquipment` eq,`tabEquipment Maintenance` eqmaint\nwhere\n    eq.name = eqmaint.equipment and\n    eq.name = %(equipment)s\nunion\nselect\n    IFNULL(eqlog.posting_date, eqlog.modified) as posting_date,\n    eq.name as name,\n    eq.status as eq_status,\n    eq.item_code as item_code,\n    eq.location as location,\n    'Equipment Log' as \"Reference Type:Data:150\",\n    eqlog.status as status,\n    eqlog.name as \"Reference:Link/Equipment Log:200\"\n    \nfrom\n    `tabEquipment` eq,`tabEquipment Log` eqlog\nwhere\n    eq.name = eqlog.equipment and\n    eq.name = %(equipment)s\n\nunion\nselect\n    IFNULL(rf.posting_date, rf.modified) as posting_date,\n    eq.name as name,\n    eq.status as eq_status,\n    eq.item_code as item_code,\n    eq.location as location,\n    'RFID Trace' as \"Reference Type:Data:150\",\n    null as status,\n    rf.name as \"Reference:Link/RFID Trace:200\"\n    \nfrom\n    `tabEquipment` eq,`tabRFID Trace` rf\nwhere\n    eq.name = rf.equipment and\n    eq.name = %(equipment)s\n\nunion\nselect\n    IFNULL(mem.posting_date, mem.modified) as posting_date,\n    eq.name as name,\n    eq.status as eq_status,\n    eq.item_code as item_code,\n    eq.location as location,\n    'Manual Equipment Movement' as \"Reference Type:Data:150\",\n    mem.type as status,\n    mem.name as \"Reference:Link/RFID Trace:200\"\n    \nfrom\n    `tabEquipment` eq,`tabManual Equipment Movement` mem\nwhere\n    eq.name = mem.equipment and\n    eq.name = %(equipment)s\n    order by posting_date desc\n",
 "ref_doctype": "Equipment",
 "report_name": "Equipment Ledger",
 "report_type": "Query Report",
 "roles": [
  {
   "role": "eusectra basic User"
  }
 ]
}